10.1046/j.1460-9568.2003.02542.x, Glucocorticoid‐induced impairment of declarative memory retrieval is associated with reduced blood flow in the medial temporal lobe 
10.1016/j.neuroimage.2008.04.173, A voxel-based morphometry study of grey matter loss in MS patients with different clinical phenotypes 
10.1111/j.1460-9568.2007.05707.x, The temporal sequence of evoked and induced cortical responses to implied‐motion processing in human motion area V5/MT+ 
10.1016/j.neuroimage.2004.07.060, Distinct representations for facial identity and changeable aspects of faces in the human temporal lobe 
10.1016/j.neuroimage.2011.02.035, Reduced striatal volume in cocaine-dependent patients 
10.1093/cercor/bhh179, Priming Effects in the Fusiform Gyrus: Changes in Neural Activity beyond the Second Presentation  
10.1016/j.biopsych.2011.05.025, The Neural Basis of Drug Stimulus Processing and Craving: An Activation Likelihood Estimation Meta-Analysis 
10.1093/cercor/bhn074, Involvement of Insula and Cingulate Cortices in Control and Suppression of Natural Urges  
10.1002/hbm.10068, Medial temporal lobe activation during context‐dependent relational processes in episodic retrieval: An fMRI study 
10.1016/j.neuropsychologia.2008.11.030, Parietal modules for reaching 
10.1016/j.schres.2011.09.015, Neurological soft signs and gray matter changes: A longitudinal analysis in first-episode schizophrenia 
10.1371/journal.pone.0010931, Dorsal Visual Pathway Changes in Patients with Comitant Extropia 
10.1016/j.neuroimage.2006.06.031, Brain–behaviour relationships in people at high genetic risk of schizophrenia 
10.1093/brain/awp011, Size matters: Increased grey matter in boys with conduct problems and callous–unemotional traits  
10.1016/j.neuroimage.2010.08.015, In vivo brain anatomy of adult males with Fragile X syndrome: An MRI study 
10.1523/JNEUROSCI.5634-08.2009, The Anatomy of the Mesolimbic Reward System: A Link between Personality and the Placebo Analgesic Response  
10.1523/JNEUROSCI.1524-11.2011, A Stable Sparse Fear Memory Trace in Human Amygdala  
10.1093/cercor/12.11.1157, The Role of Rostral Brodmann Area 6 in Mental-operation Tasks: an Integrative Neuroimaging Approach  
10.1016/j.neuroimage.2004.06.026, Visual search and memory search engage extensive overlapping cerebral cortices: an fMRI study 
10.1016/j.neuroimage.2010.05.054, Aversive stimuli lead to differential amygdala activation and connectivity patterns depending on catechol-O-methyltransferase Val158Met genotype 
10.1016/j.neuroimage.2009.12.036, fMRI-adaptation evidence of overlapping neural representations for objects related in function or manipulation 
10.1002/hbm.20281, Frontoparietal cortical activity of methamphetamine‐dependent and comparison subjects performing a delay discounting task 
10.1093/brain/123.8.1624, Unconscious activation of visual cortex in the damaged right hemisphere of a parietal patient with extinction  
10.1016/j.schres.2006.11.023, Functional disconnections in the direct and indirect amygdala pathways for fear processing in schizophrenia 
10.1016/j.neuroimage.2008.12.044, Neural correlates of semantic ambiguity processing during context verification 
10.1016/j.neuropsychologia.2004.10.011, Activation in the MT-complex during visual perception of apparent motion and temporal succession 
10.1016/j.neuropsychologia.2008.01.026, Altered deactivation in individuals with genetic risk for Alzheimer's disease 
10.1016/j.brainres.2010.08.050, Interruption of visually perceived forward motion in depth evokes a cortical activation shift from spatial to intentional motor regions 
10.1016/j.neuropsychologia.2010.07.019, Distraction and target selection in the brain: An fMRI study 
10.1093/cercor/bhh087, Where Bottom-up Meets Top-down: Neuronal Interactions during Perception and Imagery  
10.1093/cercor/bhk042, The Neural Mechanisms Underlying the Müller-Lyer Illusion And Its Interaction with Visuospatial Judgments  
10.1371/journal.pone.0022902, The Neural Basis of Centre-Surround Interactions in Visual Motion Processing 
10.1016/j.brainres.2007.01.082, Distinct neural correlates underlying two- and three-dimensional mental rotations using three-dimensional objects 
10.1016/j.bandl.2011.10.005, A sensitive period for language in the visual cortex: Distinct patterns of plasticity in congenitally versus late blind adults 
10.1016/j.neuroimage.2006.08.043, Functional activation in parieto-premotor and visual areas dependent on congruency between hand movement and visual stimuli during motor-visual priming 
10.1093/cercor/bhh046, The Role of the Lateral Frontal Cortex in Causal Associative Learning: Exploring Preventative and Super-learning  
10.1093/cercor/bhm155, Qué PASA? The Posterior–Anterior Shift in Aging  
10.1523/JNEUROSCI.6021-09.2010, Which Way Was I Going? Contextual Retrieval Supports the Disambiguation of Well Learned Overlapping Navigational Routes  
10.1523/JNEUROSCI.2146-07.2007, Differential Recruitment of the Hippocampus, Medial Prefrontal Cortex, and the Human Motion Complex during Path Integration        in Humans       
10.1371/journal.pone.0003754, The Neural Basis of Object-Context Relationships on Aesthetic Judgment 
10.1093/cercor/11.6.506, Cortical Representation of Sign Language: Comparison of Deaf Signers and Hearing Non-signers  
10.1002/hbm.20741, Altered frontal‐parietal functioning during verbal working memory in children and adolescents with heavy prenatal alcohol exposure 
10.1002/hbm.20924, Biasing the organism for novelty: A pervasive property of the attention system 
10.1016/j.neulet.2008.04.061, An event-related fMRI study on risk taking by healthy individuals of high or low impulsiveness 
10.1016/j.neures.2010.09.008, fMRI of patients with social anxiety disorder during a social situation task 
10.1002/hbm.21409, Dynamically changing effects of corticosteroids on human hippocampal and prefrontal processing 
10.1016/j.neuroimage.2009.09.034, Unconsciously deciphering handwriting: Subliminal invariance for handwritten words in the visual word form area 
10.1093/brain/awh569, A functional MRI study of automatic movements in patients with Parkinson's disease  
10.1523/JNEUROSCI.0038-06.2006, Role of the Olivo-Cerebellar System in Timing  
10.1016/j.cogbrainres.2005.02.016, Neuroimaging of marijuana smokers during inhibitory processing: a pilot investigation 
10.1016/j.schres.2004.04.009, NMDA hypofunction in the posterior cingulate as a model for schizophrenia: an exploratory ketamine administration study in fMRI 
10.1016/j.neuroimage.2004.07.059, Implicit and explicit processing of kanji and kana words and non-words studied with fMRI 
10.1016/j.neuropsychologia.2008.04.020, Decoding of affective facial expressions in the context of emotional situations 
10.1371/journal.pone.0012291, Lying about the Valence of Affective Pictures: An fMRI Study 
10.1093/cercor/bhm007, Wavelength-Dependent Modulation of Brain Responses to a Working Memory Task by Daytime Light Exposure  
10.1016/j.neuroimage.2005.09.029, Cortical abnormalities in bipolar disorder investigated with MRI and voxel-based morphometry 
10.1016/j.neuroimage.2010.07.009, Cognitive levels of performance account for hemispheric lateralisation effects in dyslexic and normally reading children 
10.1523/JNEUROSCI.2238-11.2011, Explaining Left Lateralization for Words in the Ventral Occipitotemporal Cortex  
10.1016/j.biopsych.2010.11.019, The CREB1-BDNF-NTRK2 Pathway in Depression: Multiple Gene-Cognition-Environment Interactions 
10.1371/journal.pone.0006626, Endogenous Human Brain Dynamics Recover Slowly Following Cognitive Effort 
10.1016/j.biopsycho.2008.01.004, Additive effects of serotonin transporter and tryptophan hydroxylase-2 gene variation on neural correlates of affective processing 
10.1002/hbm.21300, A common right fronto‐parietal network for numerosity and duration processing: An fMRI study 
10.1523/JNEUROSCI.5501-05.2006, Cracking the Language Code: Neural Mechanisms Underlying Speech Parsing  
10.1152/jn.01052.2003, How Self-Initiated Memorized Movements Become Automatic: A Functional MRI Study  
10.1016/j.neuroimage.2005.02.026, Directing spatial attention in mental representations: Interactions between attentional orienting and working-memory load 
10.1016/j.neuroimage.2005.06.057, Phonological processing in Chinese–English bilingual biscriptals: An fMRI study 
10.1093/scan/nsp035, Serotonin transporter genotype modulates amygdala activity during mood regulation  
10.1016/j.brainres.2011.07.019, Differential magnitude coding of gains and omitted rewards in the ventral striatum 
10.1016/j.neuroimage.2010.11.076, How choice modifies preference: Neural correlates of choice justification 
10.1016/j.biopsych.2011.10.021, Limbic Scars: Long-Term Consequences of Childhood Maltreatment Revealed by Functional and Structural Magnetic Resonance Imaging 
10.1016/j.neuroimage.2008.01.030, A distinct [18F]MPPF PET profile in amnestic mild cognitive impairment compared to mild Alzheimer's disease 
10.1016/j.neuropsychologia.2007.09.003, Systemizing influences attentional processes during the Navon task: An fMRI study 
10.1046/j.1460-9568.2000.00209.x, Simultaneous movements of upper and lower limbs are coordinated by motor representations that are shared by both limbs: a PET study 
10.1016/j.neuroimage.2011.01.081, Gray matter density increase in the primary sensorimotor cortex in long-term essential blepharospasm 
10.1111/j.1460-9568.2005.04394.x, Putaminal gray matter volume decrease in panic disorder: an optimized voxel‐based morphometry study 
10.1016/j.bbr.2009.09.027, Brain activation evoked by erotic films varies with different menstrual phases: An fMRI study 
10.1523/JNEUROSCI.0412-09.2009, Speech Recognition in Younger and Older Adults: A Dependency on Low-Level Auditory Cortex  
10.1016/j.neuropsychologia.2005.08.006, Learning by doing versus learning by thinking: An fMRI study of motor and mental training 
10.1093/scan/nsq071, Changes in functioning of mesolimbic incentive processing circuits during the premenstrual phase  
10.1523/JNEUROSCI.3585-08.2008, Executed and Observed Movements Have Different Distributed Representations in Human aIPS  
10.1016/j.bandl.2009.09.003, Language or music, mother or Mozart? Structural and environmental influences on infants’ language networks 
10.1016/j.jpsychires.2011.02.008, The influence of emotional distraction on verbal working memory: An fMRI investigation comparing individuals with schizophrenia and healthy adults 
10.1016/j.biopsych.2009.05.014, From Specificity to Sensitivity: How Acute Stress Affects Amygdala Processing of Biologically Salient Stimuli 
10.1523/JNEUROSCI.0601-07.2007, Impulsive Personality Predicts Dopamine-Dependent Changes in Frontostriatal Activity during Component Processes of Working        Memory       
10.1016/j.neuroimage.2006.10.003, Cardiorespiratory fitness: A predictor of cortical plasticity in multiple sclerosis 
10.1016/j.neuroimage.2008.07.029, Role of the prefrontal cortex in human balance control 
10.1016/j.pain.2010.03.011, A prefrontal non-opioid mechanism in placebo analgesia 
10.1016/j.neuropsychologia.2009.06.010, Altered error-related activity in patients with schizophrenia 
10.1016/j.neuroimage.2004.10.046, Hippocampal functional magnetic resonance imaging during a face–name learning task in adolescents with antecedents of prematurity 
10.1016/j.bandc.2009.12.003, Sound naming in neurodegenerative disease 
10.1016/j.bandc.2009.03.006, Cognitive conflict and inhibition in primed dichotic listening 
10.1016/j.neuropsychologia.2007.08.006, Anterior cingulate cortex modulates preparatory activation during certain anticipation of negative picture 
10.1016/j.neurobiolaging.2011.06.005, Executive functions and neurocognitive aging: dissociable patterns of brain activity 
10.1016/j.neuroimage.2009.04.042, Gender differences in the functional and structural neuroanatomy of mathematical cognition 
10.1016/j.bandl.2007.11.003, Reorganization of the cerebro-cerebellar network of language production in patients with congenital left-hemispheric brain lesions 
10.1016/j.neuropsychologia.2006.06.026, Letter processing automatically recruits a sensory–motor brain network 
10.1016/j.pscychresns.2009.11.003, Working memory fMRI activation in cocaine-dependent subjects: Association with treatment response 
10.1016/j.neuroimage.2010.11.060, An fMRI investigation of empathy for ‘social pain’ and subsequent prosocial behavior 
10.1002/hbm.20236, Effect of word and syllable frequency on activation during lexical decision and reading aloud 
10.1523/JNEUROSCI.4465-11.2011, Dynamic Reconfiguration of Structural and Functional Connectivity Across Core Neurocognitive Brain Networks with Development              
10.1016/j.pain.2009.04.016, Nondermatomal somatosensory deficits in patients with chronic pain disorder: Clinical findings and hypometabolic pattern in FDG-PET 
10.1016/j.neuroimage.2004.06.023, Real-time neural activity and connectivity in healthy individuals and schizophrenia patients 
10.1002/hbm.10035, Prefrontal cortex involvement in processing incorrect arithmetic equations: Evidence from event‐related fMRI 
10.1016/j.brainres.2010.03.088, Individual differences in working memory capacity and distractor processing: Possible contribution of top–down inhibitory control 
10.1093/cercor/bhh100, When Planning Fails: Individual Differences and Error-related Brain Activity in Problem Solving  
10.1016/j.neuroimage.2006.11.041, Preparatory allocation of attention and adjustments in conflict processing 
10.1523/JNEUROSCI.3021-09.2010, Sex Differences in Stress Response Circuitry Activation Dependent on Female Hormonal Cycle  
10.1523/JNEUROSCI.3114-11.2011, Caudate Dopamine D1 Receptor Density Is Associated with Individual Differences in Frontoparietal Connectivity during Working        Memory       
10.1016/j.pscychresns.2007.04.007, Evidence for deficient modulation of amygdala response by prefrontal cortex in bipolar mania 
10.1002/hbm.20834, Superior temporal lobe dysfunction and frontotemporal dysconnectivity in subjects at risk of psychosis and in first‐episode psychosis 
10.1523/JNEUROSCI.3250-10.2010, Flexible Memories: Differential Roles for Medial Temporal Lobe and Prefrontal Cortex in Cross-Episode Binding  
10.1016/j.neuron.2004.11.022, Neuron 
10.1002/hbm.20703, White‐matter abnormalities in attention deficit hyperactivity disorder: A diffusion tensor imaging study 
10.1016/j.euroneuro.2006.10.003, Effects of frequent cannabis use on hippocampal activity during an associative memory task 
10.1093/cercor/bhg082, Interindividual Differences in Functional Interactions among Prefrontal, Parietal and Parahippocampal Regions during Working        Memory       
10.1016/j.neulet.2008.11.032, The role of the right anterior insular cortex in the right hemisphere preponderance of stimulus-preceding negativity (SPN): An fMRI study 
10.1016/j.neuropsychologia.2010.12.005, Conflict and cognitive control during sentence comprehension: Recruitment of a frontal network during the processing of Spanish object-first sentences 
10.1016/j.neuroimage.2010.11.044, The functional neuroanatomy of morphology in language production 
10.1016/j.neuroimage.2011.08.047, Componential Granger causality, and its application to identifying the source and mechanisms of the top–down biased activation that controls attention to affective vs sensory processing 
10.1016/j.neuroimage.2009.03.020, When doing nothing is an option: The neural correlates of deciding whether to act or not 
10.1016/j.neuropsychologia.2006.05.014, The special involvement of the rostrolateral prefrontal cortex in planning abilities: An event-related fMRI study with the Tower of London paradigm 
10.1016/j.neuroimage.2010.08.018, Remedial action and feedback processing in a time-estimation task: Evidence for a role of the rostral cingulate zone in behavioral adjustments without learning 
10.1371/journal.pone.0002597, Can Machines Think? Interaction and Perspective Taking with Robots Investigated via fMRI 
10.1002/hbm.20818, Genetic variation in neuregulin1 is associated with differences in prefrontal engagement in children 
10.1016/j.neuroimage.2007.04.032, Localizing the rostrolateral prefrontal cortex at the individual level 
10.1016/j.neuroimage.2008.05.039, Frontal–striatal–thalamic mediodorsal nucleus dysfunction in schizophrenia-spectrum patients during sensorimotor gating 
10.1016/j.bandc.2011.01.004, Dual-task processing in younger and older adults: Similarities and differences revealed by fMRI 
10.1371/journal.pone.0028752, How Doctors Generate Diagnostic Hypotheses: A Study of Radiological Diagnosis with Functional Magnetic Resonance Imaging 
10.1523/JNEUROSCI.0377-05.2005, Using Functional Magnetic Resonance Imaging to Assess Adaptation and Size Invariance of Shape Processing by Humans and Monkeys              
10.1016/j.neuroimage.2006.11.036, Neurophysiological correlates of relatively enhanced local visual search in autistic adolescents 
10.1093/cercor/bhq102, Cortical Temporal Dynamics of Visually Guided Behavior  
10.1111/j.1460-9568.2006.04976.x, Cognitive modulation of emotion anticipation 
10.1371/journal.pone.0017463, The Hippocampus Is Coupled with the Default Network during Memory Retrieval but Not during Memory Encoding 
10.1016/j.neuropsychologia.2009.09.020, Functional brain network abnormalities during verbal working memory performance in adolescents and young adults with dyslexia 
10.1093/cercor/13.5.508, Processing Shape, Motion and Three-dimensional Shape-from-motion in the Human Cortex  
10.1523/JNEUROSCI.3569-03.2004, The Processing of Visual Shape in the Cerebral Cortex of Human and Nonhuman Primates: A Functional Magnetic Resonance Imaging        Study       
10.1016/j.cogbrainres.2004.09.011, The neural substrate of arithmetic operations and procedure complexity 
10.1093/brain/122.6.1093, A large-scale distributed network for covert spatial attention  
10.1016/j.brainres.2011.11.050, Tempo-spatial analysis of vision-related acupoint specificity in the occipital lobe using fMRI: An ICA study 
10.1093/scan/nsr077, Culture-related differences in default network activity during visuo-spatial judgments  
10.1016/j.visres.2011.08.007, Neural bases of selective attention in action video game players 
10.1002/hbm.20211, Common deactivation patterns during working memory and visual attention tasks: An intra‐subject fMRI study at 4 Tesla 
10.1002/hbm.21002, Frontal and parietal contributions to arithmetic fact retrieval: A parametric analysis of the problem‐size effect 
10.1016/j.neuroimage.2008.01.051, Transient and linearly graded deactivation of the human default-mode network by a visual detection task 
10.1016/j.neuroimage.2011.11.058, Striatal activations signal prediction errors on confidence in the absence of external feedback 
10.1016/j.neuroscience.2007.10.061, Effects of the cholinergic agonist nicotine on reorienting of visual spatial attention and top-down attentional control 
10.1093/cercor/bhg133, Task-independent and Task-specific Age Effects on Brain Activity during Working Memory, Visual Attention and Episodic Retrieval              
10.1093/cercor/12.2.178, Face Repetition Effects in Implicit and Explicit Memory Tests as Measured by fMRI  
10.1111/j.1460-9568.2005.04212.x, The robustness of perception 
10.1016/j.bandc.2011.09.004, Are historic years understood as numbers or events? An fMRI study of numbers with semantic associations 
10.1371/journal.pone.0028337, Stimulus-Dependent Adjustment of Reward Prediction Error in the Midbrain 
10.1016/j.neuropsychologia.2005.01.021, Brain activations associated with probability matching 
10.1093/cercor/11.3.260, The Role of Dorsolateral Prefrontal Cortex in the Preparation of Forthcoming Actions: an fMRI Study  
10.1016/j.clinph.2011.04.017, Reduced movement-related beta desynchronisation in juvenile myoclonic epilepsy: A MEG study of task specific cortical modulation 
10.1093/cercor/bhm014, Anatomical Physiology of Spatial Extinction  
10.1016/j.brainres.2010.09.068, Neural mechanisms of recognizing scene configurations from multiple viewpoints 
10.1016/j.neuroimage.2011.06.005, Impact of personality on the cerebral processing of emotional prosody 
10.1002/hbm.21275, White matter integrity and behavioral activation in healthy subjects 
10.1016/j.neuroimage.2006.08.038, The effect of handedness on cortical motor activation during simple bilateral movements 
10.1002/hbm.21033, Chemotherapy‐induced structural changes in cerebral white matter and its correlation with impaired cognitive functioning in breast cancer patients 
10.1016/j.neulet.2010.09.077, An image fusion algorithm based on multi-resolution decomposition for functional magnetic resonance images 
10.1093/cercor/bhl180, Distinct and Convergent Visual Processing of High and Low Spatial Frequency Information in Faces  
10.1016/j.neuroimage.2010.09.080, Working memory maintenance of grasp-target information in the human posterior parietal cortex 
10.1016/j.neuroimage.2011.06.026, Developmental cortical thinning in fetal alcohol spectrum disorders 
10.1002/hbm.20178, Spatiotemporal mapping of cortical activity accompanying voluntary movements using an event‐related beamforming approach 
10.1016/j.neuroimage.2009.02.029, Prior MDMA (Ecstasy) use is associated with increased basal ganglia–thalamocortical circuit activation during motor task performance in humans: An fMRI study 
10.1016/j.brainres.2009.07.046, The relations between white matter and declarative memory in older children and adolescents 
10.1523/JNEUROSCI.5295-04.2005, Separating the Brain Regions Involved in Recollection and Familiarity in Recognition Memory  
10.1152/jn.01209.2003, Human Midbrain Sensitivity to Cognitive Feedback and Uncertainty During Classification Learning  
10.1016/j.neuropharm.2011.07.006, Impact of chronic hypercortisolemia on affective processing 
10.1016/j.neuroimage.2011.06.049, Mirtazapine antagonises the subjective, hormonal and neuronal effects of m-chlorophenylpiperazine (mCPP) infusion: A pharmacological-challenge fMRI (phMRI) study 
10.1093/cercor/bhp146, Nonlinear Response of the Anterior Cingulate and Prefrontal Cortex in Schizophrenia as a Function of Variable Attentional        Control       
10.1016/j.pscychresns.2007.03.002, Thalamo-cortical dysfunction in cocaine abusers: Implications in attention and perception 
10.1093/cercor/bhm198, Understanding the Neural Computations of Arbitrary Visuomotor Learning through fMRI and Associative Learning Theory  
10.1016/j.neuroimage.2009.09.016, Neural reward processing is modulated by approach- and avoidance-related personality traits 
10.1016/j.neuroimage.2004.07.065, Practice-induced changes of brain function during visual attention: a parametric fMRI study at 4 Tesla 
10.1016/j.neuron.2005.12.024, Neuron 
10.1016/j.biopsych.2010.04.015, Affect Regulation and Pain in Borderline Personality Disorder: A Possible Link to the Understanding of Self-Injury 
10.1016/j.cortex.2009.11.007, Neural response to the behaviorally relevant absence of anticipated outcomes and the presentation of potentially harmful stimuli: A human fMRI study 
10.1016/j.neuroimage.2004.07.005, How does the brain accommodate to increased task difficulty in word finding?: A functional MRI study 
10.1016/j.neuroimage.2004.07.008, Semantic processing of Chinese in left inferior prefrontal cortex studied with reversible words 
10.1016/j.neuroimage.2007.01.041, Working memory dysfunction in schizophrenia compared to healthy controls and patients with depression: Evidence from event-related fMRI 
10.1093/scan/nsn017, The human amygdala is sensitive to the valence of pictures and sounds irrespective of arousal: an fMRI study  
10.1016/j.neuroimage.2005.02.048, Cognitive control and brain resources in major depression: An fMRI study using the n-back task 
10.1016/j.jneumeth.2010.09.005, Wavelet correlation between subjects: A time-scale data driven analysis for brain mapping using fMRI 
10.1016/j.neuroimage.2010.05.059, Body mass correlates inversely with inhibitory control in response to food among adolescent girls: An fMRI study 
10.1093/cercor/bhi012, The Functional and Temporal Characteristics of Top-down Modulation in Visual Selection  
10.1016/j.biopsych.2005.06.039, Distorted Images of One’s Own Body Activates the Prefrontal Cortex and Limbic/Paralimbic System in Young Women: A Functional Magnetic Resonance Imaging Study 
10.1016/j.neuroimage.2011.10.037, Paired pulse depression in the somatosensory cortex: Associations between MEG and BOLD fMRI 
10.1093/cercor/bhn021, The Spatial Attention Network Interacts with Limbic and Monoaminergic Systems to Modulate Motivation-Induced Attention Shifts              
10.1523/JNEUROSCI.1392-08.2008, Relationships between Hippocampal Atrophy, White Matter Disruption, and Gray Matter Hypometabolism in Alzheimer's Disease              
10.1016/j.cortex.2009.05.006, Cognitive reserve modulates task-induced activations and deactivations in healthy elders, amnestic mild cognitive impairment and mild Alzheimer's disease 
10.1002/hbm.21330, Racial identification modulates default network activity for same and other races 
10.1093/cercor/bhm107, Natural Vision Reveals Regional Specialization to Local Motion and to Contrast-Invariant, Global Flow in the Human Brain  
10.1016/j.neures.2006.04.009, Navigation ability dependent neural activation in the human brain: An fMRI study 
10.1016/j.neuroimage.2008.12.053, Neural basis of interaction between target presence and display homogeneity in visual search: An fMRI study 
10.1016/j.neuroimage.2009.08.063, Identifying objects impairs knowledge of other objects: A relearning explanation for the neural repetition effect 
