10.1016/j.pscychresns.2008.01.006, Atrophy and decreased activation of fronto-parietal attention areas contribute to higher visual dysfunction in posterior cortical atrophy 
10.1002/hbm.20070, Revisiting the role of Broca's area in sentence processing: Syntactic integration versus syntactic working memory 
10.1016/j.neuroimage.2004.05.021, Somatotopic organization of human somatosensory cortices for pain: a single trial fMRI study 
10.1016/j.brainres.2005.11.097, Specialization of phonological and semantic processing in Chinese word reading 
10.1523/JNEUROSCI.0400-09.2009, Somatotopic Organization of Gentle Touch Processing in the Posterior Insular Cortex  
10.1111/j.1460-9568.2007.05824.x, Gaze pursuit, ‘attention pursuit’ and their effects on cortical activations 
10.1016/j.neulet.2008.04.085, Virtual needle pain stimuli activates cortical representation of emotions in normal volunteers 
10.1002/hbm.21264, The Less BOLD, the Wiser: Support for the latent resource hypothesis after traumatic brain injury 
10.1016/j.neuroimage.2008.07.063, Measuring brain connectivity: Diffusion tensor imaging validates resting state temporal correlations 
10.1093/cercor/bhm125, The Functional Integration of the Anterior Cingulate Cortex during Conflict Processing  
10.1016/j.neuropsychologia.2009.10.006, Dissociating the “retrieval success” regions of the brain: Effects of retrieval delay 
10.1093/scan/nsq013, Unfair? It depends: Neural correlates of fairness in social context  
10.1093/cercor/bhp229, Neuronal Encoding of Human Kinematic Invariants during Action Observation  
10.1016/j.neuropsychologia.2006.04.014, Differential activation of the amygdala and the ‘social brain’ during fearful face-processing in Asperger Syndrome 
10.1016/j.neuroimage.2007.02.043, Amygdala responses to nonlinguistic emotional vocalizations 
10.1093/cercor/bhg083, Defining a Left-lateralized Response Specific to Intelligible Speech Using fMRI  
10.1016/j.neuropsychologia.2009.08.020, Autobiographical memory in semantic dementia: A longitudinal fMRI study 
10.1093/cercor/13.7.793, Electrophysiological and Haemodynamic Correlates of Face Perception, Recognition and Priming  
10.1046/j.1460-9568.2002.02139.x, Tactile motion activates the human middle temporal/V5 (MT/V5) complex 
10.1016/j.neuroimage.2011.01.001, Top-down modulation of ventral occipito-temporal responses during visual word recognition 
10.1152/jn.00077.2008, Distinct Cortical Anatomy Linked to Subregions of the Medial Temporal Lobe Revealed by Intrinsic Functional Connectivity  
10.1002/hbm.20887, Neuroanatomical differences in brain areas implicated in perceptual and other core features of autism revealed by cortical thickness analysis and voxel‐based morphometry 
10.1016/j.neuroimage.2005.01.016, Expectancy and belief modulate the neuronal substrates of pain treated by acupuncture 
10.1523/JNEUROSCI.2384-10.2010, Corticocortical Connections Mediate Primary Visual Cortex Responses to Auditory Stimulation in the Blind  
10.1016/j.neuroimage.2011.06.059, Social anhedonia is associated with neural abnormalities during face emotion processing 
10.1016/j.neuroimage.2010.06.016, Default network activity, coupled with the frontoparietal control network, supports goal-directed cognition 
10.1111/j.1460-9568.2008.06146.x, Right hemisphere contributions to imitation tasks 
10.1016/j.neuroimage.2009.01.035, Left premotor cortex and allophonic speech perception in dyslexia: A PET study 
10.1371/journal.pone.0009664, The Neural Correlates of Visuospatial Perceptual and Oculomotor Extrapolation 
10.1093/cercor/13.5.475, The Size of Corpus Callosum Correlates with Functional Activation of Medial Motor Cortical Areas in Bimanual and Unimanual        Movements       
10.1016/j.neuroimage.2008.08.006, Action word meaning representations in cytoarchitectonically defined primary and premotor cortices 
10.1016/j.neuropsychologia.2011.08.010, The “paradoxical” engagement of the primary auditory cortex in patients with auditory verbal hallucinations: A meta-analysis of functional neuroimaging studies 
10.1016/j.bbr.2011.09.042, Moving and being moved: Differences in cerebral activation during recollection of whole-body motion 
10.1002/hbm.20309, Relationship between regional hemodynamic activity and simultaneously recorded EEG‐theta associated with mental arithmetic‐induced workload 
10.1016/j.neuron.2004.12.006, Individual Differences in Trait Anxiety Predict the Response of the Basolateral Amygdala to Unconsciously Processed Fearful Faces 
10.1016/j.neuroimage.2010.10.013, Cognitive versus automatic mechanisms of mood induction differentially activate left and right amygdala 
10.1093/cercor/bhp189, BDNF Val66Met Polymorphism Influences Motor System Function in the Human Brain  
10.1016/j.neuroimage.2004.11.021, Atlas-guided non-uniform attenuation correction in cerebral 3D PET imaging 
10.1016/j.pain.2008.05.007, Trigeminal activation using chemical, electrical, and mechanical stimuli 
10.1016/j.cortex.2009.06.006, Neural correlates of the “Aha” experiences: Evidence from an fMRI study of insight problem solving 
10.1016/j.bandl.2008.04.001, Word and letter string processing networks in schizophrenia: Evidence for anomalies and compensation 
10.1002/hbm.10048, Functional brain activation during arithmetic processing in females with fragile X syndrome is related to FMR1 protein expression 
10.1016/j.bandc.2005.11.004, Hemodynamic and electrophysiological relationship involved in human face processing: Evidence from a combined fMRI–ERP study 
10.1002/hbm.20727, Pheromone signal transduction in humans: What can be learned from olfactory loss 
10.1046/j.1460-9568.2003.02571.x, Cerebral regions processing first‐ and higher‐order motion in an opposed‐direction discrimination task 
10.1523/JNEUROSCI.2828-08.2009, Two Mechanisms for Task Switching in the Prefrontal Cortex  
10.1093/cercor/bhq065, Dissociating Valuation and Saliency Signals during Decision-Making  
10.1016/j.neuroimage.2005.05.015, Using voxel-based morphometry to map the structural changes associated with rapid conversion in MCI: A longitudinal MRI study 
10.1016/j.neuroimage.2006.11.057, Neural correlates of two imagined egocentric transformations 
10.1016/j.neuroimage.2009.06.026, Evaluation of the effective connectivity of supplementary motor areas during motor imagery using Granger causality mapping 
10.1523/JNEUROSCI.2837-07.2007, Common and Differential Ventrolateral Prefrontal Activity during Inhibition of Hand and Eye Movements  
10.1016/j.neuroimage.2005.07.018, Functional imaging of stress urinary incontinence 
10.1016/j.neurobiolaging.2010.10.014, Aging-related changes of neural mechanisms underlying visual-spatial working memory 
10.1016/j.neuroimage.2006.12.027, Ventral medial prefrontal cortex and cardiovagal control in conscious humans 
10.1093/cercor/bhn010, The Functional Architecture of the Left Posterior and Lateral Prefrontal Cortex in Humans  
10.1016/j.bandl.2008.09.010, The Two-Level Theory of verb meaning: An approach to integrating the semantics of action with the mirror neuron system 
10.1016/j.neuroimage.2007.10.032, Mirroring others' emotions relates to empathy and interpersonal competence in children 
10.1016/j.neuroimage.2011.08.012, Learning to play a melody: An fMRI study examining the formation of auditory-motor associations 
10.1523/JNEUROSCI.4753-08.2009, The Processing of Three-Dimensional Shape from Disparity in the Human Brain  
10.1016/j.neuroimage.2008.07.010, Symbolic representations of action in the human cerebellum 
10.1016/j.neuroimage.2009.03.002, Visual features of an observed agent do not modulate human brain activity during action observation 
10.1093/cercor/bhm043, The Neural Substrate of Naming Events: Effects of Processing Demands but not of Grammatical Class  
10.1016/j.neuroimage.2010.08.025, Right temporoparietal junction activation by a salient contextual cue facilitates target discrimination 
10.1016/j.brainres.2005.11.104, The role of the supplementary motor area (SMA) in word production 
10.1016/j.neuroimage.2005.02.011, Objective evidence of cognitive complaints in Chronic Fatigue Syndrome: A BOLD fMRI study of verbal working memory 
10.1016/j.neuroimage.2007.07.005, Prefrontal involvement in imitation learning of hand actions: Effects of practice and expertise 
10.1002/hbm.20693, Increased self‐focus in major depressive disorder is related to neural abnormalities in subcortical‐cortical midline structures 
10.1016/j.neuroimage.2011.07.064, Removing the effect of response time on brain activity reveals developmental differences in conflict processing in the posterior medial prefrontal cortex 
10.1016/j.neuroimage.2011.03.017, Probing the cortical network underlying the psychological refractory period: A combined EEG–fMRI study 
10.1093/cercor/11.1.59, Separate Neural Correlates for the Mnemonic Components of Successive Discrimination and Working Memory Tasks  
10.1016/j.neuroimage.2007.05.058, Common and distinct brain activation to viewing dynamic sequences of face and hand movements 
10.1371/journal.pone.0005359, Activation of the Left Inferior Frontal Gyrus in the First 200 ms of Reading: Evidence from Magnetoencephalography (MEG) 
10.1002/hbm.20002, Reciprocal modulation and attenuation in the prefrontal cortex: An fMRI study on emotional–cognitive interaction 
10.1016/j.neuroimage.2007.01.012, Mental rotation and object categorization share a common network of prefrontal and dorsal and ventral regions of posterior cortex 
10.1093/cercor/bhh084, Correlated Functional Changes of the Prefrontal Cortex in Twins Induced by Classroom Education of Second Language  
10.1002/hbm.21108, Abnormal regional spontaneous neural activity in treatment‐refractory depression revealed by resting‐state fMRI 
10.1016/j.neuroimage.2011.08.004, Moderators of the association between brain activation and farsighted choice 
10.1016/j.brainres.2011.01.052, fMRI correlates of working memory: Specific posterior representation sites for motion and position information 
10.1111/j.1460-9568.2005.03929.x, Exposure to pulse‐modulated radio frequency electromagnetic fields affects regional cerebral blood flow 
10.1016/j.neuropsychologia.2010.07.010, Hippocampal–neocortical networks differ during encoding and retrieval of relational memory: Functional and effective connectivity analyses 
10.1016/j.neuroimage.2004.12.038, Amygdala and nucleus accumbens in responses to receipt and omission of gains in adults and adolescents 
10.1093/cercor/11.1.85, Dissociable Mechanisms of Attentional Control within the Human Prefrontal Cortex  
10.1016/j.brainres.2010.04.039, An fMRI investigation of cognitive stages in reasoning by analogy 
10.1016/j.neuroimage.2009.10.007, Brain activation and lexical learning: The impact of learning phase and word type 
10.1093/scan/nsp025, The effect of acute tryptophan depletion on emotional distraction and subsequent memory  
10.1016/j.cortex.2008.11.014, Syntax without language: Neurobiological evidence for cross-domain syntactic computations 
10.1016/j.brainres.2008.09.045, Evidence for automatic sentence priming in the fusiform semantic area: Convergent ERP and fMRI findings 
10.1016/j.biopsych.2009.12.013, Simulating Neurocognitive Aging: Effects of a Dopaminergic Antagonist on Brain Activity During Working Memory 
10.1016/j.brainres.2011.11.061, Task difficulty modulates young–old differences in network expression 
10.1152/jn.00050.2004, Experience-Dependent Neural Integration of Taste and Smell in the Human Brain  
10.1016/j.brainres.2009.06.027, The effect of lexical priming on sentence comprehension: An fMRI study 
10.1016/j.biopsycho.2011.10.010, Insula reactivity and connectivity to anterior cingulate cortex when processing threat in generalized social anxiety disorder 
10.1002/hbm.20670, When all hypotheses are right: A multifocal account of dyslexia 
10.1093/cercor/bhm050, The Angular Gyrus Computes Action Awareness Representations  
10.1016/j.neuroimage.2006.02.036, Effect of task difficulty on the functional anatomy of temporal processing 
10.1523/JNEUROSCI.1639-09.2009, Differential Engagement of the Ventromedial Prefrontal Cortex by Goal-Directed and Habitual Behavior toward Food Pictures        in Humans       
10.1016/j.neuroimage.2010.08.039, Emotional conflict in interpersonal interactions 
10.1016/j.neuropsychologia.2005.02.004, Anterior prefrontal cortex and the recollection of contextual information 
10.1371/journal.pone.0018905, ANS: Aberrant Neurodevelopment of the Social Cognition Network in Adolescents with Autism Spectrum Disorders 
10.1002/hbm.20554, “Aha!”: The neural correlates of verbal insight solutions 
10.1371/journal.pone.0026859, fMRI Supports the Sensorimotor Theory of Motor Resonance 
10.1002/hbm.20364, Voxel‐based morphometry study of brain volumetry and diffusivity in amyotrophic lateral sclerosis patients with mild disability 
10.1093/brain/awl181, The basal ganglia are hyperactive during the discrimination of tactile stimuli in writer's cramp  
10.1016/j.neuropsychologia.2007.06.015, Left ventrolateral prefrontal cortex and the cognitive control of memory 
10.1016/j.biopsycho.2007.12.002, A functional variant of the tryptophan hydroxylase 2 gene impacts working memory: A genetic imaging study 
10.1016/j.neuroimage.2008.01.039, Neural correlates of age-related changes in cortical neurophysiology 
10.1016/j.neurobiolaging.2005.09.017, Activation of brain regions vulnerable to Alzheimer's disease: The effect of mild cognitive impairment 
10.1093/cercor/bhr264, Rostral Prefrontal Cortex and the Focus of Attention in Prospective Memory  
10.1371/journal.pone.0025307, The Value of Success: Acquiring Gains, Avoiding Losses, and Simply Being Successful 
10.1523/JNEUROSCI.3140-11.2011, The Relationship between Brain Oscillations and BOLD Signal during Memory Formation: A Combined EEG–fMRI Study  
10.1016/j.neuron.2006.11.022, Neuron 
10.1002/hbm.21336, Rostrolateral prefrontal cortex: Domain‐general or domain‐sensitive? 
10.1093/cercor/bhk024, Neural Correlates of Processing Valence and Arousal in Affective Words  
10.1016/j.neuropsychologia.2009.06.002, A role for right ventrolateral prefrontal cortex in reasoning about indeterminate relations 
10.1016/j.bandl.2011.09.003, Identifying bilingual semantic neural representations across languages 
10.1002/hbm.10046, Modulation of activity in temporal cortex during generation of inner speech 
10.1093/cercor/bhn083, Sensitivity of the Action Observation Network to Physical and Observational Learning  
10.1016/j.schres.2008.06.013, An fMRI study of working memory in first-degree unaffected relatives of schizophrenia patients 
10.1093/cercor/10.7.706, Maintaining and Shifting Attention within Left or Right Hemifield  
10.1016/j.neuroimage.2005.05.019, Spatial registration of multichannel multi-subject fNIRS data to MNI space without MRI 
10.1002/hbm.20472, Spatial nonuniformity of the resting CBF and BOLD responses to sevoflurane: In vivo study of normal human subjects with magnetic resonance imaging 
10.1002/(SICI)1097-0193(200002)9:2<72::AID-HBM2>3.0.CO;2-9, Human brain areas involved in the analysis of auditory movement 
10.1093/cercor/bhi055, Developmental Changes in Mental Arithmetic: Evidence for Increased Functional Specialization in the Left Inferior Parietal        Cortex       
10.1016/j.neuropsychologia.2005.03.025, The cerebellum's involvement in the judgment of spatial orientation: A functional magnetic resonance imaging study 
10.1016/j.neulet.2007.06.039, Human brain activation in response to olfactory stimulation by intravenous administration of odorants 
10.1016/j.neuropsychologia.2011.02.023, Neural correlates of choice behavior related to impulsivity and venturesomeness 
10.1093/scan/nsm010, Perception of dynamic changes in facial affect and identity in autism  
10.1002/hbm.20166, Method for multimodal analysis of independent source differences in schizophrenia: Combining gray matter structural and auditory oddball functional data 
10.1016/j.cogbrainres.2005.01.023, Involvement of both prefrontal and inferior parietal cortex in dual-task performance 
10.1016/j.neuroimage.2011.06.038, Novelty increases the mesolimbic functional connectivity of the substantia nigra/ventral tegmental area (SN/VTA) during reward anticipation: Evidence from high-resolution fMRI 
10.1002/hbm.20807, Dysregulation of working memory and default‐mode networks in schizophrenia using independent component analysis, an fBIRN and MCIC study 
10.1093/cercor/bhj112, Effects of Healthy Aging on Hippocampal and Rhinal Memory Functions: An Event-Related fMRI Study  
10.1016/j.neuropsychologia.2005.06.010, Neural mechanisms of imitation and ‘mirror neuron’ functioning in autistic spectrum disorder 
10.1016/j.mri.2010.10.008, A conditional Granger causality model approach for group analysis in functional magnetic resonance imaging 
10.1016/j.neuroimage.2006.12.012, Load response functions in the human spatial working memory circuit during location memory updating 
10.1093/cercor/bhq188, Neural Correlates of Developing and Adapting Behavioral Biases in Speeded Choice Reactions—An fMRI Study on Predictive Motor        Coding       
10.1016/j.neuroimage.2009.01.043, The neural basis of overall similarity and single-dimension sorting 
10.1093/cercor/10.6.552, An Event-related Functional MRI Study of the Stroop Color Word Interference Task  
10.1016/j.neuroimage.2008.08.008, Piecemeal recruitment of left-lateralized brain areas during reading: A spatio-functional account 
10.1002/hbm.20323, Temporal lobe interictal epileptic discharges affect cerebral activity in “default mode” brain regions 
10.1002/hbm.20225, A developmental fMRI study of self‐regulatory control 
10.1002/hbm.21020, A functional dissociation of conflict processing within anterior cingulate cortex 
10.1016/j.neuroimage.2005.01.003, The effect of encoding strategies on medial temporal lobe activations during the recognition of words: an event-related fMRI study 
10.1016/j.neuroimage.2009.01.042, Made you look! Consciously perceived, irrelevant instructional cues can hijack the attentional network 
10.1016/j.neuroimage.2010.04.271, Quantitative modeling of the neural representation of objects: How semantic feature norms can account for fMRI activation 
10.1093/cercor/bhp056, Developmental Trajectories of Magnitude Processing and Interference Control: An fMRI Study  
10.1093/cercor/bhn209, Functional Connectivity of the Inferior Frontal Cortex Changes with Age in Children with Autism Spectrum Disorders: A fcMRI        Study of Response Inhibition       
10.1016/j.neuroimage.2005.11.055, Language experience shapes fusiform activation when processing a logographic artificial language: An fMRI training study 
10.1016/j.neuroimage.2006.06.050, Cerebral correlates of the “Kohnstamm phenomenon”: An fMRI study 
10.1093/cercor/bhq164, Morphometric Differences in the Heschl's Gyrus of Hearing Impaired and Normal Hearing Infants  
10.1016/j.neuroimage.2005.02.012, Neural substrates of faulty decision-making in abstinent marijuana users 
10.1016/j.pnpbp.2010.12.001, Antipsychotic dose and diminished neural modulation: A multi-site fMRI study 
10.1523/JNEUROSCI.5280-10.2011, Effective Treatment of Chronic Low Back Pain in Humans Reverses Abnormal Brain Anatomy and Function  
10.1016/j.neuroimage.2010.09.026, Challenges to attention: A continuous arterial spin labeling (ASL) study of the effects of distraction on sustained attention 
10.1016/j.pscychresns.2005.06.003, Brain activity during emotionally negative pictures in schizophrenia with and without flat affect: An fMRI study 
10.1002/hbm.20324, Altered functional connectivity in early Alzheimer's disease: A resting‐state fMRI study 
10.1016/j.biopsych.2009.04.013, Guanfacine Potentiates the Activation of Prefrontal Cortex Evoked by Warning Signals 
10.1016/j.jneumeth.2011.08.033, Microcontroller based fibre-optic visual presentation system for multisensory neuroimaging 
10.1523/JNEUROSCI.3444-09.2010, Neural Basis of Individual Differences in Synesthetic Experiences  
10.1016/j.neuroimage.2010.09.067, Age- and gender-related changes in the normal human brain using hybrid diffusion imaging (HYDI) 
10.1016/j.neuroimage.2004.07.054, Brain activation associated with evaluative processes of guilt and embarrassment: an fMRI study 
10.1016/j.brainres.2006.12.048, The neural mechanism of imagining facial affective expression 
10.1016/j.brainres.2010.04.044, Effective connectivities of cortical regions for top-down face processing: A Dynamic Causal Modeling study 
10.1002/hbm.20706, Dissociable neural effects of stimulus valence and preceding context during the inhibition of responses to emotional faces 
10.1371/journal.pone.0007911, Evidence for Anomalous Network Connectivity during Working Memory Encoding in Schizophrenia: An ICA Based Analysis 
10.1523/JNEUROSCI.4273-06.2007, Functional Coupling of Human Prefrontal and Premotor Areas during Cognitive Manipulation  
10.1016/j.bandl.2006.11.011, Neural correlates for learning to read Roman numerals 
10.1016/j.neuroimage.2006.07.020, Distinct spatial patterns of brain activity associated with memory storage and search 
10.1002/hbm.20339, Tyrosine depletion alters cortical and limbic blood flow but does not modulate spatial working memory performance or task‐related blood flow in humans 
10.1016/j.neuroimage.2008.10.019, Age-associated reduction of asymmetry in prefrontal function and preservation of conceptual repetition priming 
10.1093/cercor/bhj088, Basal Ganglia Functional Connectivity Based on a Meta-Analysis of 126 Positron Emission Tomography and Functional Magnetic        Resonance Imaging Publications       
10.1016/j.biopsych.2005.10.025, Cortical Inefficiency in Patients with Unipolar Depression: An Event-Related fMRI Study with the Stroop Task 
10.1111/j.1460-9568.2004.03766.x, Is there a role of visual cortex in spatial hearing? 
10.1016/j.bandc.2008.07.014, Differences in processing of taxonomic and sequential relations in semantic memory: An fMRI investigation 
10.1016/j.neuropsychologia.2005.01.004, Emotional content and reality-monitoring ability: fMRI evidence for the influences of encoding processes 
10.1016/j.neuroimage.2007.03.033, A fronto-parietal network is mediating improvement of motor function related to repetitive peripheral magnetic stimulation: A PET-H2O15 study 
10.1016/j.neuroimage.2004.07.047, Spatial and temporal dissociation in prefrontal cortex during action execution 
10.1016/j.biopsych.2009.03.019, Psychopathy and Functional Magnetic Resonance Imaging Blood Oxygenation Level-Dependent Responses to Emotional Faces in Violent Patients with Schizophrenia 
10.1016/j.neuroimage.2011.08.039, Biological motion processing: The left cerebellum communicates with the right superior temporal sulcus 
10.1002/hbm.21243, Neural processing of social rejection: The role of schizotypal personality traits 
10.1016/j.neuroimage.2010.01.049, Amygdala integrates emotional expression and gaze direction in response to dynamic facial expressions 
10.1016/j.cogbrainres.2005.09.004, Double dissociation in neural correlates of visual working memory: A PET study 
10.1016/j.neuroimage.2008.01.059, Right temporopolar activation associated with unique perception 
10.1093/brain/awn329, Limitations to plasticity of language network reorganization in localization related epilepsy  
10.1002/hbm.20578, Resting in peace or noise: Scanner background noise suppresses default‐mode network 
10.1016/j.neuroimage.2005.10.031, Using fMRI to decompose the neural processes underlying the Wisconsin Card Sorting Test 
10.1016/j.bandl.2011.08.005, From storage to manipulation: How the neural correlates of verbal working memory reflect varying demands on inner speech 
10.1016/j.neuron.2007.02.015, Categorization Training Results in Shape- and Category-Selective Human Neural Plasticity 
10.1002/hbm.21207, Experience induces functional reorganization in brain regions involved in odor imagery in perfumers 
10.1016/j.neuroimage.2008.05.041, Proactive inhibitory control of movement assessed by event-related fMRI 
10.1016/j.neuroimage.2006.11.013, Functional dissociations in top–down control dependent neural repetition priming 
10.1016/j.neuropsychologia.2011.07.004, Event congruency and episodic encoding: A developmental fMRI study 
10.1016/j.neuropsychologia.2008.03.013, Orbitofrontal and hippocampal contributions to memory for face–name associations: The rewarding power of a smile 
10.1111/j.1460-9568.2006.04823.x, Contribution of the corpus callosum to bilateral representation of the trunk midline in the human brain: an fMRI study of callosotomized patients 
10.1016/j.neuroimage.2011.05.006, Selective updating of working memory content modulates meso-cortico-striatal activity 
10.1016/j.bandl.2011.11.004, Colateralization of Broca’s area and the visual word form area in left-handers: fMRI evidence 
10.1016/j.neuroimage.2005.01.047, Cross-modal activation of visual cortex during depth perception using auditory substitution of vision 
10.1016/j.brainres.2010.07.056, Differences in cerebral activation during perception of optokinetic computer stimuli and video clips of living animals: An fMRI study 
10.1016/j.neuropsychologia.2008.06.010, The influence of prior record on moral judgment 
10.1016/j.neuroimage.2011.03.037, Differential effects of DAAO on regional activation and functional connectivity in schizophrenia, bipolar disorder and controls 
10.1016/j.neuroimage.2004.07.031, When less means more: deactivations during encoding that predict subsequent memory 
10.1016/j.jpsychires.2010.09.007, Neural correlates of emotional processing in depression: Changes with cognitive behavioral therapy and predictors of treatment response 
