10.1093/cercor/bhn248, Double Dissociation between Motor and Visual Imagery in the Posterior Parietal Cortex  
10.1111/j.1460-9568.2009.06973.x, Distinct brain networks in recognition memory share a defined region in the precuneus 
10.1016/j.pscychresns.2010.06.005, Changes of brain activation pre- post short-term psychodynamic inpatient psychotherapy: An fMRI study of panic disorder patients 
10.1093/cercor/bhm197, Where Vision Meets Memory: Prefrontal–Posterior Networks for Visual Object Constancy during Categorization and Recognition              
10.1016/j.neuroimage.2008.02.026, Anatomical substrates of cooperative joint-action in a continuous motor task: Virtual lifting and balancing 
10.1016/j.neuroimage.2010.10.021, Impact of transient emotions on functional connectivity during subsequent resting state: A wavelet correlation approach 
10.1016/j.neuroimage.2011.11.078, The neural correlates of gist-based true and false recognition 
10.1016/j.neulet.2005.05.028, Visual attention deficits in Alzheimer's disease: an fMRI study 
10.1016/j.neuroimage.2005.06.001, Asymmetric modulation of human visual cortex activity during 10° lateral gaze (fMRI study) 
10.1016/j.bandl.2005.07.072, Large-scale neural network for sentence processing 
10.1371/journal.pone.0024253, Spatial Language Processing in the Blind: Evidence for a Supramodal Representation and Cortical Reorganization 
10.1016/j.neuropsychologia.2006.08.015, Children with reading disorder show modality independent brain abnormalities during semantic tasks 
10.1002/hbm.20953, Individual differences in socioaffective skills influence the neural bases of fear processing: The case of alexithymia 
10.1016/j.clinph.2011.04.009, The effect of one left-sided dorsolateral prefrontal sham-controlled HF-rTMS session on approach and withdrawal related emotional neuronal processes 
10.1016/j.brainres.2008.12.073, Cortical activity during manual response inhibition guided by color and orientation cues 
10.1002/hbm.20982, fMRI study of mesial temporal lobe epilepsy using amplitude of low‐frequency fluctuation analysis 
10.1016/j.neuroimage.2011.10.072, Dissociable roles for lateral orbitofrontal cortex and lateral prefrontal cortex during preference driven reversal learning 
10.1016/j.neuropsychologia.2009.03.019, Attentional control of task and response in lateral and medial frontal cortex: Brain activity and reaction time distributions 
10.1016/j.neuroimage.2011.10.070, Similar behaviour, different brain patterns: Age-related changes in neural signatures of ignoring 
10.1016/j.biopsych.2005.12.020, Activation in Ventral Prefrontal Cortex is Sensitive to Genetic Vulnerability for Attention-Deficit Hyperactivity Disorder 
10.1002/hbm.21450, The influence of visual training on predicting complex action sequences 
10.1093/cercor/bhn132, Neural Correlates of Speeded as Compared with Delayed Responses in a Stop Signal Task: An Indirect Analog of Risk Taking and        Association with an Anxiety Trait       
10.1093/cercor/bhj026, Functional Dissociation of Attentional Selection within PFC: Response and Non-response Related Aspects of Attentional Selection        as Ascertained by fMRI       
10.1093/cercor/bhq012, Specialization of the Rostral Prefrontal Cortex for Distinct Analogy Processes  
10.1016/j.neuroimage.2007.12.028, Genetically dependent modulation of serotonergic inactivation in the human prefrontal cortex 
10.1002/hbm.20441, Neural correlates of noncanonical syntactic processing revealed by a picture‐sentence matching task 
10.1016/j.neuroimage.2008.02.058, Cortical mechanisms of retinal and extraretinal smooth pursuit eye movements to different target velocities 
10.1016/j.neulet.2009.07.061, Attentional modulation of emotional stimulus processing in patients with major depression—Alterations in prefrontal cortical regions 
10.1016/j.eurpsy.2007.11.006, Prepulse inhibition and “psychosis-proneness” in healthy individuals: An fMRI study 
10.1371/journal.pone.0005987, Induction of Empathy by the Smell of Anxiety 
10.1371/journal.pone.0013155, Dissociable Processes of Cognitive Control during Error and Non-Error Conflicts: A Study of the Stop Signal Task 
10.1002/hbm.20720, Fact learning in complex arithmetic and figural‐spatial tasks: The role of the angular gyrus and its relation to mathematical competence 
10.1093/scan/nsn019, Mentalizing about emotion and its relationship to empathy  
10.1016/j.neubiorev.2010.12.005, Neuroanatomy of vulnerability to psychosis: A voxel-based meta-analysis 
10.1016/j.neuroimage.2007.09.062, Neural substrates of visuomotor learning based on improved feedback control and prediction 
10.1093/cercor/bhm245, Dissociation between Explicit Memory and Configural Memory in the Human Medial Temporal Lobe  
10.1016/j.neuropsychologia.2007.07.003, Effects of aging on true and false memory formation: An fMRI study 
10.1093/scan/nsq025, Shared brain activity for aesthetic and moral judgments: implications for the Beauty-is-Good stereotype  
10.1016/j.neuroimage.2005.04.013, Imaging phonology without print: Assessing the neural correlates of phonemic awareness using fMRI 
10.1002/hbm.20546, Developmental differences of neurocognitive networks for phonological and semantic processing in Chinese word reading 
10.1016/j.neuron.2005.12.025, Task and Content Modulate Amygdala-Hippocampal Connectivity in Emotional Retrieval 
10.1016/j.neuroimage.2005.09.058, Understanding metamemory: Neural correlates of the cognitive process and subjective level of confidence in recognition memory 
10.1093/cercor/bhl173, The Feeling of Familiarity of Music and Odors: The Same Neural Signature?  
10.1093/scan/nsq067, Eyes on me: an fMRI study of the effects of social gaze on action control  
10.1016/j.neurobiolaging.2005.05.011, Age differences in the neural systems supporting human allocentric spatial navigation 
10.1093/cercor/bhr268, Connectivity-Based Subdivisions of the Human Right “Temporoparietal Junction Area”: Evidence for Different Areas Participating        in Different Cortical Networks       
10.1093/cercor/bhq203, Lateralization is Predicted by Reduced Coupling from the Left to Right Prefrontal Cortex during Semantic Decisions on Written        Words       
10.1093/cercor/bhn187, Retrieval and Unification of Syntactic Structure in Sentence Comprehension: an fMRI Study Using Word-Category Ambiguity  
10.1093/scan/nsr074, Distinct but overlapping neural networks subserve depression and insecure attachment  
10.1016/j.cogbrainres.2004.10.006, Neural representations of graspable objects: are tools special? 
10.1016/j.neuroimage.2005.08.050, Parametric modulation of cortical activation during smooth pursuit with and without target blanking. An fMRI study 
10.1016/j.brainres.2010.06.056, A neural system for evaluating the behavioural relevance of salient events outside the current focus of attention 
10.1016/j.neulet.2010.11.073, Overlapping clusters of gray matter deficits in paranoid schizophrenia and psychotic bipolar mania with family history 
10.1093/cercor/bhl122, Differential Contributions of Prefrontal, Medial Temporal, and Sensory-Perceptual Regions to True and False Memory Formation              
10.1002/hbm.20602, Consciousness and cerebral baseline activity fluctuations 
10.1016/j.neurobiolaging.2008.09.014, Age-related changes in neural activity associated with familiarity, recollection and false recognition 
10.1016/j.neuron.2009.05.021, The Brain under Self-Control: Modulation of Inhibitory and Monitoring Cortical Networks during Hypnotic Paralysis 
10.1016/j.neulet.2011.10.022, Cortical regions underlying successful encoding of semantically congruent and incongruent associations between common auditory and visual objects 
10.1016/j.neuroimage.2009.03.061, Auditory–motor integration during fast repetition: The neuronal correlates of shadowing 
10.1002/hbm.20313, The interaction between orthographic and phonological information in children: An fMRI study 
10.1523/JNEUROSCI.0334-11.2011, Prediction of Reading Skill Several Years Later Depends on Age and Brain Region: Implications for Developmental Models of        Reading       
10.1016/j.neuropsychologia.2011.02.051, Imagery and retrieval of auditory and visual information: Neural correlates of successful and unsuccessful performance 
10.1002/hbm.10115, Learning networks in health and Parkinson's disease: Reproducibility and treatment effects 
10.1016/j.brainres.2008.06.107, fMRI characterization of the language formulation area 
10.1016/j.brainres.2011.05.057, Can you hear a difference? Neuronal correlates of melodic deviance processing in children 
10.1016/j.neuropsychologia.2009.03.017, Compassionate attitude towards others’ suffering activates the mesolimbic neural system 
10.1016/j.neuroimage.2010.03.023, Auditory temporal expectations modulate activity in visual cortex 
10.1016/j.neuropsychologia.2006.03.010, Evidence for a dysfunction of left posterior reading areas in German dyslexic readers 
10.1016/j.neuroimage.2007.02.024, Neural mechanisms of auditory awareness underlying verbal transformations 
10.1523/JNEUROSCI.1375-10.2010, Development of the Selection and Manipulation of Self-Generated Thoughts in Adolescence  
10.1093/cercor/13.10.1023, Dynamic Perception of Facial Affect and Identity in the Human Brain  
10.1016/j.bandl.2010.06.002, Functional anatomy of listening and reading comprehension during development 
10.1523/JNEUROSCI.4640-10.2011, Anterior Hippocampus and Goal-Directed Spatial Decision Making  
10.1002/hbm.20185, Direction‐dependent visual cortex activation during horizontal optokinetic stimulation (fMRI study) 
10.1093/cercor/bhi007, Action Observation and Acquired Motor Skills: An fMRI Study with Expert Dancers  
10.1002/hbm.20478, Brain network dynamics during error commission 
10.1002/hbm.20637, Disentangling the prefrontal network for rule selection by means of a non‐verbal variant of the Wisconsin Card Sorting Test 
10.1002/hbm.20621, Self‐regulation of regional cortical activity using real‐time fMRI: The right inferior frontal gyrus and linguistic processing 
10.1093/cercor/bhn045, Interaction of Working Memory and Long-Term Memory in the Medial Temporal Lobe  
10.1016/j.bandl.2007.12.009, Effective brain connectivity in children with reading difficulties during phonological processing 
10.1016/j.neuroimage.2007.06.020, Audiovisual integration of emotional signals in voice and face: An event-related fMRI study 
10.1523/JNEUROSCI.1792-04.2005, Catechol-O-Methyltransferase val158met Genotype Affects Processing of Emotional Stimuli in the Amygdala and Prefrontal Cortex              
10.1016/j.neuroimage.2010.06.028, It is not always tickling: Distinct cerebral responses during perception of different laughter types 
10.1016/j.neuropsychologia.2011.02.020, Effects of emotion regulation strategy on brain responses to the valence and social content of visual scenes 
10.1016/j.neuroimage.2005.07.029, Modulation of language areas with functional MR image-guided magnetic stimulation 
10.1016/j.bandl.2005.01.009, Neural substrates for verbal working memory in deaf signers: fMRI study and lesion case report 
10.1016/j.neuroimage.2008.10.027, Developmental changes in category-specific brain responses to numbers and letters in a working memory task 
10.1002/hbm.20288, Imaging brain activity during natural vision using CASL perfusion fMRI 
10.1016/j.cogbrainres.2004.10.004, Neural substrates in judgment process while playing go: a comparison of amateurs with professionals 
10.1523/JNEUROSCI.1300-09.2009, Functional Connectivity Delineates Distinct Roles of the Inferior Frontal Cortex and Presupplementary Motor Area in Stop Signal        Inhibition       
10.1016/j.neuroimage.2010.03.036, Dissociable responses to punishment in distinct striatal regions during reversal learning 
10.1523/JNEUROSCI.0565-08.2008, Spoken Word Memory Traces within the Human Auditory Cortex Revealed by Repetition Priming and Functional Magnetic Resonance        Imaging       
10.1016/j.neuropsychologia.2011.10.022, Both left and right posterior parietal activations contribute to compensatory processes in normal aging 
10.1016/j.pain.2005.08.027, Mechanisms of placebo analgesia: rACC recruitment of a subcortical antinociceptive network 
10.1002/hbm.20768, Detection of differential speech‐specific processes in the temporal lobe using fMRI and a dynamic “sound morphing” technique 
10.1016/j.neuroimage.2006.06.067, Impact of modality and linguistic complexity during reading and listening tasks 
10.1016/j.cortex.2008.07.002, Listening to rhythms activates motor and premotor cortices 
10.1016/j.cogbrainres.2005.08.017, Action selectivity in parietal and temporal cortex 
10.1093/brain/awh632, Functional dysconnectivity in schizophrenia associated with attentional modulation of motor function  
10.1523/JNEUROSCI.1856-10.2010, Acute and Sustained Effects of Cognitive Emotion Regulation in Major Depression  
10.1016/j.pscychresns.2007.07.007, Neural systems for executive and emotional processing are modulated by symptoms of posttraumatic stress disorder in Iraq War veterans 
10.1371/journal.pone.0026681, Visualization of Painful Experiences Believed to Trigger the Activation of Affective and Emotional Brain Regions in Subjects with Low Back Pain 
10.1016/j.biopsych.2011.06.029, Clinical Symptoms and Alpha Band Resting-State Functional Connectivity Imaging in Patients With Schizophrenia: Implications for Novel Approaches to Treatment 
10.1046/j.1460-9568.2003.02673.x, What you believe versus what you think they believe: a neuroimaging study of conceptual perspective‐taking 
10.1016/j.schres.2010.01.030, Altered activation and functional connectivity of neural systems supporting cognitive control of emotion in psychosis proneness 
10.1093/cercor/bhr238, A Role for the Motor System in Binding Abstract Emotional Meaning  
10.1523/JNEUROSCI.5058-10.2011, Why Clowns Taste Funny: The Relationship between Humor and Semantic Ambiguity  
10.1016/j.neuroimage.2007.03.055, Differential brain processing of audiovisual sexual stimuli in men: Comparative positron emission tomography study of the initiation and maintenance of penile erection during sexual arousal 
10.1002/hbm.21218, The role of planum temporale in processing accent variation in spoken language comprehension 
10.1016/j.neuroimage.2011.06.094, Motion-related artefacts in EEG predict neuronally plausible patterns of activation in fMRI data 
10.1093/cercor/bhn065, Functional Dissociation in Right Inferior Frontal Cortex during Performance of Go/No-Go Task  
10.1523/JNEUROSCI.4261-09.2009, Behavioral and Neural Evidence of Incentive Bias for Immediate Rewards Relative to Preference-Matched Delayed Rewards  
10.1002/hbm.21377, Brain regions that process case: Evidence from basque 
10.1523/JNEUROSCI.1172-11.2011, fMRI Adaptation Reveals a Cortical Mechanism for the Coding of Space Near the Hand  
10.1371/journal.pone.0001794, Modulation of Brain Resting-State Networks by Sad Mood Induction 
10.1016/j.neuroimage.2011.01.019, Robustness of intrinsic connectivity networks in the human brain to the presence of acoustic scanner noise 
10.1016/j.neuroimage.2006.07.007, Weaker top–down modulation from the left inferior frontal gyrus in children 
10.1093/cercor/bhr324, Reading Salt Activates Gustatory Brain Regions: fMRI Evidence for Semantic Grounding in a Novel Sensory Modality  
10.1093/cercor/bhn161, A Dual Role for Prediction Error in Associative Learning  
10.1093/brain/awh500, Somatosensory activations during the observation of touch and a case of vision–touch synaesthesia  
10.1093/scan/nsq070, Influence of contingency awareness on neural, electrodermal and evaluative responses during fear conditioning  
10.1523/JNEUROSCI.3978-04.2005, Language-Related Activations in the Left Prefrontal Regions Are Differentially Modulated by Age, Proficiency, and Task Demands              
10.1016/j.neuroimage.2010.04.035, Multi-voxel coding of stimuli, rules, and responses in human frontoparietal cortex 
10.1371/journal.pone.0014224, Changes in Resting Neural Connectivity during Propofol Sedation 
10.1016/j.neuropsychologia.2011.11.008, Distinct roles of the ‘Shared Pain’ and ‘Theory of Mind’ networks in processing others’ emotional suffering 
10.1016/j.bandl.2008.11.002, Semantic domain-specific functional integration for action-related vs. abstract concepts 
10.1016/j.neuroimage.2008.08.004, Negation in the brain: Modulating action representations 
10.1093/scan/nsr072, Judgment before principle: engagement of the frontoparietal control network in condemning harms of omission  
10.1371/journal.pone.0028817, Resting-State Brain Organization Revealed by Functional Covariance Networks 
10.1016/j.neuroimage.2006.01.001, Prediction error as a linear function of reward probability is coded in human nucleus accumbens 
10.1016/j.bandl.2010.12.001, Conduction aphasia, sensory-motor integration, and phonological short-term memory – An aggregate analysis of lesion and fMRI data 
10.1002/hbm.21191, Interaction of electrical stimulation and voluntary hand movement in SII and the cerebellum during simulated therapeutic functional electrical stimulation in healthy adults 
10.1016/j.neuropsychologia.2010.01.012, Brain regions involved in the learning and application of reward rules in a two-deck gambling task 
10.1016/j.neuropsychologia.2010.09.030, Neurobiological correlates of theory of mind in psychosis proneness 
10.1016/j.neuroimage.2011.04.004, Amplitude low-frequency oscillation abnormalities in the heroin users: A resting state fMRI study 
10.1016/j.neuroimage.2005.01.058, Passive somatosensory discrimination tasks in healthy volunteers: Differential networks involved in familiar versus unfamiliar shape and length discrimination 
10.1016/j.neuropsychologia.2008.01.025, What activates the human mirror neuron system during observation of artificial movements: Bottom-up visual features or top-down intentions? 
10.1523/JNEUROSCI.1138-06.2006, On Measuring the Perceived Onsets of Spontaneous Actions  
10.1371/journal.pone.0008622, A Neurosemantic Theory of Concrete Noun Representation Based on the Underlying Brain Codes 
10.1016/j.bandl.2006.04.008, Neuroanatomically separable effects of imageability and grammatical class during single-word comprehension 
10.1093/scan/nsp013, Emotion regulation in spider phobia: role of the medial prefrontal cortex  
10.1093/cercor/bhi123, Two Distinct Neural Mechanisms for Category-selective Responses  
10.1016/j.neuropsychologia.2010.06.010, Neural correlates of familiarity-based associative retrieval 
10.1016/j.neuropsychologia.2007.11.035, fMRI activation during episodic encoding and metacognitive appraisal across the lifespan: Risk factors for Alzheimer's disease 
10.1093/cercor/bhl079, Differential Parahippocampal and Retrosplenial Involvement in Three Types of Visual Scene Recognition  
10.1016/j.neuroimage.2004.12.019, Hippocampus activity differentiates good from poor learners of a novel lexicon 
10.1002/hbm.20285, Functional neural circuits for mental timekeeping 
10.1523/JNEUROSCI.3489-08.2009, Relating Structure to Function: Heschl's Gyrus and Acoustic Processing  
10.1016/j.neuroimage.2010.05.072, Enhancing creativity by means of cognitive stimulation: Evidence from an fMRI study 
10.1523/JNEUROSCI.3054-08.2009, Dynamic Changes in Brain Activity during Prism Adaptation  
10.1093/brain/awn300, The neural basis of surface dyslexia in semantic dementia  
10.1002/hbm.20835, Functional and anatomical connectivity abnormalities in left inferior frontal gyrus in schizophrenia 
10.1016/j.neuroimage.2009.04.087, Cerebral control of the lower urinary tract: How age-related changes might predispose to urge incontinence 
10.1016/j.neuroimage.2008.09.028, Cerebral representations of space and time 
10.1111/j.1460-9568.2005.04092.x, Neuronal mechanisms underlying control of a brain–computer interface 
10.1016/j.neuroimage.2010.12.040, fMRI item analysis in a theory of mind task 
10.1016/j.neuroimage.2004.08.013, Temporal lobe activations of “feeling-of-knowing” induced by face-name associations 
10.1016/j.neuroimage.2008.01.009, Specialisation in Broca's region for semantic, phonological, and syntactic fluency? 
10.1016/j.neuroimage.2010.09.078, Effective connectivity analysis demonstrates involvement of premotor cortex during speech perception 
10.1371/journal.pone.0012233, Autistic Disorders and Schizophrenia: Related or Remote? An Anatomical Likelihood Estimation 
10.1016/j.pain.2008.07.030, An fMRI study measuring analgesia enhanced by religion as a belief system 
10.1016/j.neuroimage.2006.03.038, Dissociation of neural responses and skin conductance reactions during fear conditioning with and without awareness of stimulus contingencies 
10.1002/hbm.20051, Brain–behavior correlation in children depends on the neurocognitive network 
10.1016/j.brainres.2007.05.045, A network for audio–motor coordination in skilled pianists and non-musicians 
10.1523/JNEUROSCI.0822-06.2006, Multisensory Activation of the Intraparietal Area When Classifying Grating Orientation: A Functional Magnetic Resonance Imaging        Study       
10.1002/hbm.20514, Neurofunctional modulation of brain regions by distinct forms of motor cognition and movement features 
10.1093/cercor/bhn196, Neuroanatomical Correlates of Musicianship as Revealed by Cortical Thickness and Voxel-Based Morphometry  
10.1016/j.neuroimage.2009.12.112, ALE meta-analysis of action observation and imitation in the human brain 
10.1111/j.1460-9568.2003.03066.x, Effector‐independent representations of simple and complex imagined finger movements: a combined fMRI and TMS study 
10.1016/j.neuroimage.2004.12.041, Neural correlates of distance and congruity effects in a numerical Stroop task: an event-related fMRI study 
10.1093/scan/nsp043, Self-involvement modulates the effective connectivity of the autobiographical memory network  
10.1093/scan/nsn027, Amygdala activation during reading of emotional adjectives—an advantage for pleasant content  
10.1371/journal.pone.0027241, Music and Emotions in the Brain: Familiarity Matters 
10.1002/hbm.20562, Voluntary activation and cortical activity during a sustained maximal contraction: An fMRI study 
10.1016/j.neuroimage.2006.03.024, An fMRI study of cerebral processing of brush-evoked allodynia in neuropathic pain patients 
10.1016/j.neuroimage.2005.03.038, Retrieving accurate and distorted memories: Neuroimaging evidence for effects of emotion 
10.1016/j.neuropsychologia.2006.06.019, Neural correlates of differential retrieval orientation: Sustained and item-related components 
10.1016/j.neulet.2006.07.030, Imaging gene–substance interactions: The effect of the DRD2 TaqIA polymorphism and the dopamine agonist bromocriptine on the brain activation during the anticipation of reward 
10.1016/j.neuroimage.2010.05.080, Animated brain: A functional neuroimaging study on animacy experience 
10.1002/hbm.20957, Left cytoarchitectonic BA 44 processes syntactic gender violations in determiner phrases 
10.1016/j.neuroimage.2009.11.079, Sadness enhances the experience of pain via neural activation in the anterior cingulate cortex and amygdala: An fMRI study 
10.1016/j.neures.2011.05.007, How negative affect influences neural control processes underlying the resolution of cognitive interference: An event-related fMRI study 
10.1016/j.neuropsychologia.2008.09.017, Modulation of motor and premotor cortices by actions, action words and action sentences 
10.1016/j.neuroimage.2009.05.061, Continuous performance of a novel motor sequence leads to highly correlated striatal and hippocampal perfusion increases 
10.1016/j.neuropsychologia.2005.10.009, Cortical correlates of face and scene inversion: A comparison 
10.1093/cercor/bhn037, Neural Correlates of True Memory, False Memory, and Deception  
10.1016/j.neulet.2011.06.045, Cortical fMRI activation to opponents’ body kinematics in sport-related anticipation: Expert-novice differences with normal and point-light video 
10.1093/cercor/bhj006, Temporal Dissociation of Early Lexical Access and Articulation Using a Delayed Naming Task — An fMRI Study  
10.1016/j.bandc.2011.03.019, Perception of suffering and compassion experience: Brain gender disparities 
10.1093/brain/awl228, Pain sensitivity and fMRI pain-related brain activity in Alzheimer's disease  
10.1016/j.neurobiolaging.2010.09.022, Aging of human supraspinal locomotor and postural control in fMRI 
10.1016/j.biopsych.2007.01.011, Erythropoietin Reduces Neural and Cognitive Processing of Fear in Human Models of Antidepressant Drug Action 
10.1093/cercor/bhm243, The Effects of Aging on the Neural Correlates of Subjective and Objective Recollection  
10.1002/hbm.21040, Cortical organization of environmental sounds by attribute 
10.1002/hbm.21034, Altered functional connectivity in default mode network in absence epilepsy: A resting‐state fMRI study 
10.1016/j.neuroimage.2010.10.012, Cognitive state and connectivity effects of the genome-wide significant psychosis variant in ZNF804A 
10.1093/cercor/13.2.162, Foot, Hand, Face and Eye Representation in the Human Striatum  
10.1093/scan/nsn020, Self-reflection across time: cortical midline structures differentiate between present and past selves  
10.1523/JNEUROSCI.4845-10.2011, Task-Load-Dependent Activation of Dopaminergic Midbrain Areas in the Absence of Reward  
10.1093/scan/nsr038, Amygdala responses to averted vs direct gaze fear vary as a function of presentation speed  
10.1016/j.neuroimage.2010.09.041, The BOLD correlates of the visual P1 and N1 in single-trial analysis of simultaneous EEG-fMRI recordings during a spatial detection task 
10.1523/JNEUROSCI.1916-08.2008, Neural Markers of Inhibition in Human Memory Retrieval  
10.1016/j.neuroimage.2010.07.013, The neural substrates of musical memory revealed by fMRI and two semantic tasks 
